{"schemaVersion":"ckb-portable-path-policy-v1","baselineState":"historicalPrePortableBaseline","unmappedAction":"fail","sourceRootRuleId":"source-lock-repository-commit-tree-relative-v1","allowlist":["/dev/null","/usr/bin/env"],"placeholders":["{{CKB_PATH:ABSOLUTE}}","{{CKB_PATH:BUILD_ROOT}}","{{CKB_PATH:INSTALL_ROOT}}","{{CKB_PATH:PROJECT_ROOT}}","{{CKB_PATH:SDK_ROOT}}","{{CKB_PATH:SOURCE_ROOT}}","{{CKB_PATH:TMPDIR}}","{{CKB_PATH:USER_HOME}}"],"fieldCoverage":["chunk","citation","content","derivedFrom","path","repo","sourceId","sourceUrl","title"],"categories":[{"id":"absolute_path_semantics_example","action":"semantic_placeholder"},{"id":"declared_project_root","action":"placeholder"},{"id":"non_filesystem_slash_text","action":"preserve"},{"id":"runtime_state","action":"exclude"},{"id":"sdk_install_build_tmp","action":"explicit_root_placeholder"},{"id":"source_locator","action":"source_lock_relative"},{"id":"unmapped","action":"fail"},{"id":"user_home","action":"placeholder"}]}